{
  "$schema": "https://developer.microsoft.com/json-schemas/fabric/item/report/definition/visualContainer/2.9.0/schema.json",
  "name": "supporting-records",
  "position": {
    "x": 24,
    "y": 386,
    "width": 1232,
    "height": 166,
    "z": 7,
    "tabOrder": 7
  },
  "visual": {
    "visualType": "tableEx",
    "visualContainerObjects": {
      "background": [
        {
          "properties": {
            "show": {
              "expr": {
                "Literal": {
                  "Value": "true"
                }
              }
            },
            "color": {
              "solid": {
                "color": {
                  "expr": {
                    "Literal": {
                      "Value": "'#FFFFFF'"
                    }
                  }
                }
              }
            },
            "transparency": {
              "expr": {
                "Literal": {
                  "Value": "0D"
                }
              }
            }
          }
        }
      ],
      "border": [
        {
          "properties": {
            "show": {
              "expr": {
                "Literal": {
                  "Value": "false"
                }
              }
            }
          }
        }
      ],
      "padding": [
        {
          "properties": {
            "top": {
              "expr": {
                "Literal": {
                  "Value": "4D"
                }
              }
            },
            "bottom": {
              "expr": {
                "Literal": {
                  "Value": "4D"
                }
              }
            },
            "left": {
              "expr": {
                "Literal": {
                  "Value": "4D"
                }
              }
            },
            "right": {
              "expr": {
                "Literal": {
                  "Value": "4D"
                }
              }
            }
          }
        }
      ],
      "title": [
        {
          "properties": {
            "show": {
              "expr": {
                "Literal": {
                  "Value": "true"
                }
              }
            },
            "text": {
              "expr": {
                "Literal": {
                  "Value": "'Supporting saved records'"
                }
              }
            },
            "fontColor": {
              "solid": {
                "color": {
                  "expr": {
                    "Literal": {
                      "Value": "'#183E35'"
                    }
                  }
                }
              }
            },
            "fontSize": {
              "expr": {
                "Literal": {
                  "Value": "12D"
                }
              }
            },
            "fontFamily": {
              "expr": {
                "Literal": {
                  "Value": "'Segoe UI'"
                }
              }
            }
          }
        }
      ]
    },
    "query": {
      "queryState": {
        "Values": {
          "projections": [
            {
              "field": {
                "Column": {
                  "Expression": {
                    "SourceRef": {
                      "Entity": "SavedRecords"
                    }
                  },
                  "Property": "supplier_id"
                }
              },
              "queryRef": "SavedRecords.supplier_id",
              "displayName": "Supplier id"
            },
            {
              "field": {
                "Column": {
                  "Expression": {
                    "SourceRef": {
                      "Entity": "SavedRecords"
                    }
                  },
                  "Property": "part_id"
                }
              },
              "queryRef": "SavedRecords.part_id",
              "displayName": "Part id"
            },
            {
              "field": {
                "Column": {
                  "Expression": {
                    "SourceRef": {
                      "Entity": "SavedRecords"
                    }
                  },
                  "Property": "status"
                }
              },
              "queryRef": "SavedRecords.status",
              "displayName": "Status"
            },
            {
              "field": {
                "Column": {
                  "Expression": {
                    "SourceRef": {
                      "Entity": "SavedRecords"
                    }
                  },
                  "Property": "audit_complete"
                }
              },
              "queryRef": "SavedRecords.audit_complete",
              "displayName": "Audit complete"
            },
            {
              "field": {
                "Column": {
                  "Expression": {
                    "SourceRef": {
                      "Entity": "SavedRecords"
                    }
                  },
                  "Property": "first_article_complete"
                }
              },
              "queryRef": "SavedRecords.first_article_complete",
              "displayName": "First article complete"
            },
            {
              "field": {
                "Column": {
                  "Expression": {
                    "SourceRef": {
                      "Entity": "SavedRecords"
                    }
                  },
                  "Property": "expected_decision_date"
                }
              },
              "queryRef": "SavedRecords.expected_decision_date",
              "displayName": "Expected decision date"
            }
          ]
        }
      }
    },
    "objects": {
      "columnHeaders": [
        {
          "properties": {
            "fontColor": {
              "solid": {
                "color": {
                  "expr": {
                    "Literal": {
                      "Value": "'#FFFFFF'"
                    }
                  }
                }
              }
            },
            "backColor": {
              "solid": {
                "color": {
                  "expr": {
                    "Literal": {
                      "Value": "'#183E35'"
                    }
                  }
                }
              }
            },
            "fontSize": {
              "expr": {
                "Literal": {
                  "Value": "11D"
                }
              }
            }
          }
        }
      ],
      "values": [
        {
          "properties": {
            "fontColorPrimary": {
              "solid": {
                "color": {
                  "expr": {
                    "Literal": {
                      "Value": "'#183E35'"
                    }
                  }
                }
              }
            },
            "backColorPrimary": {
              "solid": {
                "color": {
                  "expr": {
                    "Literal": {
                      "Value": "'#FFFFFF'"
                    }
                  }
                }
              }
            },
            "backColorSecondary": {
              "solid": {
                "color": {
                  "expr": {
                    "Literal": {
                      "Value": "'#F5F3EA'"
                    }
                  }
                }
              }
            },
            "fontSize": {
              "expr": {
                "Literal": {
                  "Value": "11D"
                }
              }
            }
          }
        }
      ],
      "total": [
        {
          "properties": {
            "totals": {
              "expr": {
                "Literal": {
                  "Value": "false"
                }
              }
            }
          }
        }
      ],
      "grid": [
        {
          "properties": {
            "rowPadding": {
              "expr": {
                "Literal": {
                  "Value": "5D"
                }
              }
            }
          }
        }
      ]
    }
  },
  "filterConfig": {
    "filters": [
      {
        "name": "LockedRecordRowVisible",
        "field": {
          "Measure": {
            "Expression": {
              "SourceRef": {
                "Entity": "CaseCommandCenter"
              }
            },
            "Property": "Record Row Visible"
          }
        },
        "type": "Advanced",
        "howCreated": "User",
        "isHiddenInViewMode": true,
        "isLockedInViewMode": true,
        "filter": {
          "Version": 2,
          "From": [
            {
              "Name": "c",
              "Entity": "CaseCommandCenter",
              "Type": 0
            }
          ],
          "Where": [
            {
              "Condition": {
                "Comparison": {
                  "ComparisonKind": 0,
                  "Left": {
                    "Measure": {
                      "Expression": {
                        "SourceRef": {
                          "Source": "c"
                        }
                      },
                      "Property": "Record Row Visible"
                    }
                  },
                  "Right": {
                    "Literal": {
                      "Value": "1L"
                    }
                  }
                }
              }
            }
          ]
        }
      }
    ]
  }
}
