{
  "$schema": "https://developer.microsoft.com/json-schemas/fabric/item/report/definition/visualContainer/2.9.0/schema.json",
  "name": "operational-chart",
  "position": {
    "x": 824,
    "y": 166,
    "width": 432,
    "height": 456,
    "z": 7,
    "tabOrder": 7
  },
  "visual": {
    "visualType": "clusteredColumnChart",
    "visualContainerObjects": {
      "background": [
        {
          "properties": {
            "show": {
              "expr": {
                "Literal": {
                  "Value": "true"
                }
              }
            },
            "color": {
              "solid": {
                "color": {
                  "expr": {
                    "Literal": {
                      "Value": "'#FFFFFF'"
                    }
                  }
                }
              }
            },
            "transparency": {
              "expr": {
                "Literal": {
                  "Value": "0D"
                }
              }
            }
          }
        }
      ],
      "border": [
        {
          "properties": {
            "show": {
              "expr": {
                "Literal": {
                  "Value": "false"
                }
              }
            }
          }
        }
      ],
      "padding": [
        {
          "properties": {
            "top": {
              "expr": {
                "Literal": {
                  "Value": "4D"
                }
              }
            },
            "bottom": {
              "expr": {
                "Literal": {
                  "Value": "4D"
                }
              }
            },
            "left": {
              "expr": {
                "Literal": {
                  "Value": "4D"
                }
              }
            },
            "right": {
              "expr": {
                "Literal": {
                  "Value": "4D"
                }
              }
            }
          }
        }
      ],
      "title": [
        {
          "properties": {
            "show": {
              "expr": {
                "Literal": {
                  "Value": "true"
                }
              }
            },
            "text": {
              "expr": {
                "Literal": {
                  "Value": "'Purchase and shipment lines by supplier (count)'"
                }
              }
            },
            "fontColor": {
              "solid": {
                "color": {
                  "expr": {
                    "Literal": {
                      "Value": "'#183E35'"
                    }
                  }
                }
              }
            },
            "fontSize": {
              "expr": {
                "Literal": {
                  "Value": "12D"
                }
              }
            },
            "fontFamily": {
              "expr": {
                "Literal": {
                  "Value": "'Segoe UI'"
                }
              }
            },
            "titleWrap": {
              "expr": {
                "Literal": {
                  "Value": "true"
                }
              }
            }
          }
        }
      ]
    },
    "query": {
      "queryState": {
        "Category": {
          "projections": [
            {
              "field": {
                "Column": {
                  "Expression": {
                    "SourceRef": {
                      "Entity": "OperationalRecords"
                    }
                  },
                  "Property": "supplier_name"
                }
              },
              "queryRef": "OperationalRecords.supplier_name",
              "nativeQueryRef": "supplier_name",
              "displayName": "Supplier name",
              "active": true
            }
          ]
        },
        "Y": {
          "projections": [
            {
              "field": {
                "Measure": {
                  "Expression": {
                    "SourceRef": {
                      "Entity": "OperationalRecords"
                    }
                  },
                  "Property": "Supply Line Count"
                }
              },
              "queryRef": "OperationalRecords.Supply Line Count",
              "nativeQueryRef": "Supply Line Count"
            }
          ]
        }
      }
    },
    "objects": {
      "labels": [
        {
          "properties": {
            "show": {
              "expr": {
                "Literal": {
                  "Value": "true"
                }
              }
            },
            "fontSize": {
              "expr": {
                "Literal": {
                  "Value": "10D"
                }
              }
            }
          }
        }
      ],
      "dataPoint": [
        {
          "properties": {
            "defaultColor": {
              "solid": {
                "color": {
                  "expr": {
                    "Literal": {
                      "Value": "'#187D78'"
                    }
                  }
                }
              }
            }
          }
        }
      ],
      "categoryAxis": [
        {
          "properties": {
            "fontSize": {
              "expr": {
                "Literal": {
                  "Value": "10D"
                }
              }
            }
          }
        }
      ],
      "valueAxis": [
        {
          "properties": {
            "show": {
              "expr": {
                "Literal": {
                  "Value": "true"
                }
              }
            },
            "fontSize": {
              "expr": {
                "Literal": {
                  "Value": "10D"
                }
              }
            }
          }
        }
      ]
    }
  },
  "filterConfig": {
    "filters": [
      {
        "name": "operations-deliveries-operational-chart-LockedSupplyLineRowVisible",
        "field": {
          "Measure": {
            "Expression": {
              "SourceRef": {
                "Entity": "OperationalRecords"
              }
            },
            "Property": "Supply Line Row Visible"
          }
        },
        "type": "Advanced",
        "howCreated": "User",
        "isHiddenInViewMode": true,
        "isLockedInViewMode": true,
        "filter": {
          "Version": 2,
          "From": [
            {
              "Name": "c",
              "Entity": "OperationalRecords",
              "Type": 0
            }
          ],
          "Where": [
            {
              "Condition": {
                "Comparison": {
                  "ComparisonKind": 0,
                  "Left": {
                    "Measure": {
                      "Expression": {
                        "SourceRef": {
                          "Source": "c"
                        }
                      },
                      "Property": "Supply Line Row Visible"
                    }
                  },
                  "Right": {
                    "Literal": {
                      "Value": "1L"
                    }
                  }
                }
              }
            }
          ]
        }
      }
    ]
  }
}
