{
  "$schema": "https://developer.microsoft.com/json-schemas/fabric/item/report/definition/visualContainer/2.9.0/schema.json",
  "name": "outcome-source-details",
  "position": {
    "x": 644,
    "y": 574,
    "width": 612,
    "height": 96,
    "z": 11,
    "tabOrder": 11
  },
  "visual": {
    "visualType": "tableEx",
    "visualContainerObjects": {
      "background": [
        {
          "properties": {
            "show": {
              "expr": {
                "Literal": {
                  "Value": "true"
                }
              }
            },
            "color": {
              "solid": {
                "color": {
                  "expr": {
                    "Literal": {
                      "Value": "'#FFFFFF'"
                    }
                  }
                }
              }
            },
            "transparency": {
              "expr": {
                "Literal": {
                  "Value": "0D"
                }
              }
            }
          }
        }
      ],
      "border": [
        {
          "properties": {
            "show": {
              "expr": {
                "Literal": {
                  "Value": "false"
                }
              }
            }
          }
        }
      ],
      "padding": [
        {
          "properties": {
            "top": {
              "expr": {
                "Literal": {
                  "Value": "4D"
                }
              }
            },
            "bottom": {
              "expr": {
                "Literal": {
                  "Value": "4D"
                }
              }
            },
            "left": {
              "expr": {
                "Literal": {
                  "Value": "4D"
                }
              }
            },
            "right": {
              "expr": {
                "Literal": {
                  "Value": "4D"
                }
              }
            }
          }
        }
      ],
      "title": [
        {
          "properties": {
            "show": {
              "expr": {
                "Literal": {
                  "Value": "true"
                }
              }
            },
            "text": {
              "expr": {
                "Literal": {
                  "Value": "'Source details — recorded outcome identities'"
                }
              }
            },
            "fontColor": {
              "solid": {
                "color": {
                  "expr": {
                    "Literal": {
                      "Value": "'#183E35'"
                    }
                  }
                }
              }
            },
            "fontSize": {
              "expr": {
                "Literal": {
                  "Value": "12D"
                }
              }
            },
            "fontFamily": {
              "expr": {
                "Literal": {
                  "Value": "'Segoe UI'"
                }
              }
            }
          }
        }
      ]
    },
    "query": {
      "queryState": {
        "Values": {
          "projections": [
            {
              "field": {
                "Column": {
                  "Expression": {
                    "SourceRef": {
                      "Entity": "ActionOutcomes"
                    }
                  },
                  "Property": "metric"
                }
              },
              "queryRef": "ActionOutcomes.metric",
              "nativeQueryRef": "metric",
              "displayName": "Metric"
            },
            {
              "field": {
                "Column": {
                  "Expression": {
                    "SourceRef": {
                      "Entity": "ActionOutcomes"
                    }
                  },
                  "Property": "observation_kind"
                }
              },
              "queryRef": "ActionOutcomes.observation_kind",
              "nativeQueryRef": "observation_kind",
              "displayName": "Outcome type"
            },
            {
              "field": {
                "Column": {
                  "Expression": {
                    "SourceRef": {
                      "Entity": "ActionOutcomes"
                    }
                  },
                  "Property": "case_key"
                }
              },
              "queryRef": "ActionOutcomes.case_key",
              "nativeQueryRef": "case_key",
              "displayName": "Case key"
            },
            {
              "field": {
                "Column": {
                  "Expression": {
                    "SourceRef": {
                      "Entity": "ActionOutcomes"
                    }
                  },
                  "Property": "decision_key"
                }
              },
              "queryRef": "ActionOutcomes.decision_key",
              "nativeQueryRef": "decision_key",
              "displayName": "Decision key"
            },
            {
              "field": {
                "Column": {
                  "Expression": {
                    "SourceRef": {
                      "Entity": "ActionOutcomes"
                    }
                  },
                  "Property": "action_key"
                }
              },
              "queryRef": "ActionOutcomes.action_key",
              "nativeQueryRef": "action_key",
              "displayName": "Action key"
            }
          ]
        }
      }
    },
    "objects": {
      "columnHeaders": [
        {
          "properties": {
            "fontColor": {
              "solid": {
                "color": {
                  "expr": {
                    "Literal": {
                      "Value": "'#FFFFFF'"
                    }
                  }
                }
              }
            },
            "backColor": {
              "solid": {
                "color": {
                  "expr": {
                    "Literal": {
                      "Value": "'#183E35'"
                    }
                  }
                }
              }
            },
            "fontSize": {
              "expr": {
                "Literal": {
                  "Value": "11D"
                }
              }
            }
          }
        }
      ],
      "values": [
        {
          "properties": {
            "fontColorPrimary": {
              "solid": {
                "color": {
                  "expr": {
                    "Literal": {
                      "Value": "'#183E35'"
                    }
                  }
                }
              }
            },
            "backColorPrimary": {
              "solid": {
                "color": {
                  "expr": {
                    "Literal": {
                      "Value": "'#FFFFFF'"
                    }
                  }
                }
              }
            },
            "backColorSecondary": {
              "solid": {
                "color": {
                  "expr": {
                    "Literal": {
                      "Value": "'#F5F3EA'"
                    }
                  }
                }
              }
            },
            "fontSize": {
              "expr": {
                "Literal": {
                  "Value": "11D"
                }
              }
            }
          }
        }
      ],
      "total": [
        {
          "properties": {
            "totals": {
              "expr": {
                "Literal": {
                  "Value": "false"
                }
              }
            }
          }
        }
      ],
      "grid": [
        {
          "properties": {
            "rowPadding": {
              "expr": {
                "Literal": {
                  "Value": "5D"
                }
              }
            }
          }
        }
      ]
    }
  },
  "filterConfig": {
    "filters": [
      {
        "name": "actions-outcomes-outcome-source-details-LockedObservationRowVisible",
        "field": {
          "Measure": {
            "Expression": {
              "SourceRef": {
                "Entity": "CaseCommandCenter"
              }
            },
            "Property": "Observation Row Visible"
          }
        },
        "type": "Advanced",
        "howCreated": "User",
        "isHiddenInViewMode": true,
        "isLockedInViewMode": true,
        "filter": {
          "Version": 2,
          "From": [
            {
              "Name": "c",
              "Entity": "CaseCommandCenter",
              "Type": 0
            }
          ],
          "Where": [
            {
              "Condition": {
                "Comparison": {
                  "ComparisonKind": 0,
                  "Left": {
                    "Measure": {
                      "Expression": {
                        "SourceRef": {
                          "Source": "c"
                        }
                      },
                      "Property": "Observation Row Visible"
                    }
                  },
                  "Right": {
                    "Literal": {
                      "Value": "1L"
                    }
                  }
                }
              }
            }
          ]
        }
      }
    ]
  }
}
